theme_id,theme_label,theme_family,primary_size,total_size,secondary_additions,cohesion_primary,cohesion_with_secondary,dominant_sector,dominant_industry,sample_symbols
IND::Banks::A,Banks · Group 2,Banks,12,25,13,0.289,0.2555,Financial Services,Banks,"AUBANK, BAJFINANCE, BANKBARODA, BANKINDIA, CANBK, CHOLAFIN, CSBBANK, DCBBANK"
IND::Banks::B::B,Banks · Group 1,Banks,14,24,10,0.3432,0.2652,Financial Services,Banks,"ABCAPITAL, BAJFINANCE, BANKBARODA, BANKINDIA, CANBK, CUB, DCBBANK, HDFCAMC"
IND::Finance (including NBFCs)::B::B,Finance (including Nbfcs) · Group 2,Finance (including Nbfcs),8,24,16,0.2809,0.2763,Financial Services,Finance (including NBFCs),"AUBANK, AXISBANK, BAJAJFINSV, BAJFINANCE, CHOLAFIN, CHOLAHLDNG, CREDITACC, CSBBANK"
IND::Iron & Steel/Interm.Products,Iron & Steel / Interm.products,Iron & Steel / Interm.products,14,22,8,0.0715,0.1505,Basic Materials,Iron & Steel/Interm.Products,"APLAPOLLO, GPIL, HINDALCO, HINDCOPPER, IMFA, JINDALSTEL, JSL, JSWSTEEL"
IND::Personal Products,Personal Products,Personal Products,13,20,7,0.2037,0.2514,Consumer Defensive,Personal Products,"BAJAJCON, BRITANNIA, COLPAL, DABUR, DMART, EMAMILTD, GILLETTE, GODREJCP"
IND::Agrochemicals,Agrochemicals,Agrochemicals,11,19,8,0.1317,0.1452,Basic Materials,Agrochemicals,"AKZOINDIA, ANURAS, ATUL, BAYERCROP, DEEPAKFERT, DHANUKA, EPIGRAL, GREENPLY"
IND::Industrial Machinery::B,Industrial Machinery · Group 2,Industrial Machinery,9,19,10,0.0629,0.1593,Industrials,Industrial Machinery,"ABB, AZAD, BDL, CUMMINSIND, ELECON, FINPIPE, GPPL, HAL"
IND::Auto Parts & Equipment::B::B::A,Auto Parts & Equipment · Group 2,Auto Parts & Equipment,11,18,7,0.2311,0.1977,Consumer Cyclical,Auto Parts & Equipment,"ARVINDFASN, CIEINDIA, HEROMOTOCO, JAMNAAUTO, JTEKTINDIA, LANDMARK, LGBBROSLTD, LUMAXIND"
IND::Healthcare Facilities,Healthcare Facilities,Healthcare Facilities,14,18,4,0.0856,0.1053,Healthcare,Healthcare Facilities,"APOLLOHOSP, ARTEMISMED, ASTERDM, ASTRAZEN, CAPLIPOINT, FORTIS, HCG, JLHL"
IND::Packaged Foods,Packaged Foods,Packaged Foods,9,18,9,0.1049,0.2186,Consumer Defensive,Packaged Foods,"BECTORFOOD, BIKAJI, BRITANNIA, CCL, DABUR, DMART, DODLA, EMAMILTD"
IND::Specialty Chemicals::A,Specialty Chemicals · Group 1,Specialty Chemicals,14,18,4,0.0959,0.1289,Basic Materials,Specialty Chemicals,"AARTIIND, AETHER, ATUL, BASF, BERGEPAINT, CHAMBLFERT, CLEAN, DEEPAKFERT"
IND::Auto Parts & Equipment::B::A,Auto Parts & Equipment · Group 1,Auto Parts & Equipment,14,17,3,0.1463,0.1465,Consumer Cyclical,Auto Parts & Equipment,"ASAHIINDIA, BOSCHLTD, ENDURANCE, EPL, FIEMIND, HEROMOTOCO, LUMAXTECH, MOTHERSON"
UNCLASSIFIED::B::A::B,Cross-sector · Group 1,Cross-sector,14,17,3,0.2809,0.2725,,,"AFCONS, BBOX, CARRARO, CEIGALL, DAMCAPITAL, DYNAMATECH, E2E, FIRSTCRY"
IND::Heavy Electrical Equipment::A,Heavy Electrical Equipment · Group 1,Heavy Electrical Equipment,8,17,9,0.0864,0.1753,Industrials,Heavy Electrical Equipment,"ABB, ASHOKA, BAJEL, BEML, BHEL, CGPOWER, CUMMINSIND, GESHIP"
IND::Other Industrial Products,Other Industrial Products,Other Industrial Products,12,17,5,0.1465,0.1877,Industrials,Other Industrial Products,"ASHOKLEY, BHARATFORG, CARBORUNIV, FINCABLES, GESHIP, GRINDWELL, GRSE, HAPPYFORGE"
IND::Banks::B::A,Banks · Group 3,Banks,4,16,12,0.3996,0.3016,Financial Services,Banks,"AUBANK, AXISBANK, BANDHANBNK, CANFINHOME, EQUITASBNK, FIVESTAR, IDBI, IDEA"
IND::Breweries & Distilleries,Breweries & Distilleries,Breweries & Distilleries,14,16,2,0.1412,0.1541,Consumer Defensive,Breweries & Distilleries,"ABDL, BALRAMCHIN, CCL, GLOBUSSPR, GODREJAGRO, GODREJCP, HINDUNILVR, LTFOODS"
UNCLASSIFIED::B::B::A::B::B,Cross-sector · Group 3,Cross-sector,12,16,4,,0.2349,,,"ABLBL, ANTHEM, ASHAPURMIN, BRIGHOTEL, CRIZAC, EBGNG, ELLEN, ENRIN"
IND::Finance (including NBFCs)::B::A,Finance (including Nbfcs) · Group 1,Finance (including Nbfcs),8,16,8,0.1368,0.2077,Financial Services,Finance (including NBFCs),"CHOLAFIN, ICICIGI, IDBI, M&MFIN, MANAPPURAM, MUTHOOTFIN, PFC, PNB"
IND::Other Electrical Equipment/Products::B,Other Electrical Equipment / Products · Group 1,Other Electrical Equipment / Products,12,16,4,0.1715,0.1565,Industrials,Other Electrical Equipment/Products,"3MINDIA, BBL, FINCABLES, GRAVITA, HAVELLS, HONAUT, KAYNES, KEI"
IND::Pharmaceuticals::B::B,Pharmaceuticals · Group 1,Pharmaceuticals,14,16,2,0.148,0.1365,Healthcare,Pharmaceuticals,"ABBOTINDIA, ANUP, ASTRAZEN, CAPLIPOINT, GLAND, GLAXO, GUFICBIO, IPCALAB"
IND::Pharmaceuticals::B::A::B::B,Pharmaceuticals · Group 2,Pharmaceuticals,13,16,3,0.2383,0.2329,Healthcare,Pharmaceuticals,"AJANTPHARM, ALKEM, ARTEMISMED, AUROPHARMA, DRREDDY, ERIS, GLENMARK, GRANULES"
IND::Shipping,Shipping,Shipping,4,16,12,0.3125,0.2345,Industrials,Shipping,"3MINDIA, ARE&M, BDL, BEL, BEML, DATAPATTNS, ENGINERSIN, GESHIP"
IND::2/3 Wheelers,2 / 3 Wheelers,2 / 3 Wheelers,4,15,11,0.4637,0.2372,Consumer Cyclical,2/3 Wheelers,"AVL, BAJAJ-AUTO, EICHERMOT, HEROMOTOCO, MARUTI, METROBRAND, MINDACORP, MOTHERSON"
IND::Consumer Electronics,Consumer Electronics,Consumer Electronics,12,15,3,0.0977,0.1259,Consumer Cyclical,Consumer Electronics,"AMBER, BALKRISIND, BLUESTARCO, CDSL, DIXON, EMIL, GOKEX, MAHSCOOTER"
IND::Defence,Defence,Defence,8,15,7,0.3124,0.2614,Industrials,Defence,"ABB, ASTRAMICRO, BBL, BDL, BEL, CONCOR, DATAPATTNS, GRSE"
IND::Furniture-Furnishing-Paints,Furniture-furnishing-paints,Furniture-furnishing-paints,11,15,4,0.0473,0.0465,Basic Materials,Furniture-Furnishing-Paints,"AGI, AKZOINDIA, ASIANPAINT, BERGEPAINT, BIRLACORPN, CERA, GREENLAM, INDIGOPNTS"
IND::Housing Finance,Housing Finance,Housing Finance,10,15,5,0.1719,0.1962,Financial Services,Housing Finance,"AAVAS, APTUS, AXISBANK, BANKBARODA, CANFINHOME, FIVESTAR, HOMEFIRST, HUDCO"
IND::Internet Software & Services,Internet Software & Services,Internet Software & Services,15,15,0,0.0315,0.0315,Communication Services,Internet Software & Services,"AADHARHFC, AFFLE, INDIAMART, INDUSTOWER, JUSTDIAL, MAPMYINDIA, MPSLTD, NAUKRI"
IND::Cement & Cement Products,Cement & Cement Products,Cement & Cement Products,13,14,1,0.1137,0.1094,Basic Materials,Cement & Cement Products,"ACC, AMBUJACEM, BIRLACORPN, DALBHARAT, FLUOROCHEM, GRASIM, INDIACEM, JKCEMENT"
UNCLASSIFIED::B::A::B::NoRank::1,Cross-sector (no Rank) · Group 1,Cross-sector (no Rank),14,14,0,,,,,"AEQUS, BHARATCOAL, CAPILLARY, CRAMC, EUROPRATIK, JAINREC, LENSKART, MBEL"
UNCLASSIFIED::B::A::B::NoRank::2,Cross-sector (no Rank) · Group 2,Cross-sector (no Rank),14,14,0,,,,,"AMAGI, BUILDPRO, CORONA, EMMVEE, GROWW, JSWCEMENT, LGEINDIA, MEESHO"
UNCLASSIFIED::B::A::B::NoRank::3,Cross-sector (no Rank) · Group 3,Cross-sector (no Rank),14,14,0,,,,,"ATLANTAELE, CANHLIFE, CPPLUS, EPACKPEB, ICICIAMC, KSHINTL, LOTUSDEV, MIDWESTLTD"
UNCLASSIFIED::A::A,Cross-sector · Group 2,Cross-sector,13,14,1,0.3183,0.3386,,,"AFCONS, AGARWALEYE, AIIL, ASHAPURMIN, CEMPRO, GALLANTT, IKS, KRN"
IND::IT Consulting & Software::B::B::A::B,IT Consulting & Software · Group 1,IT Consulting & Software,10,14,4,0.2838,0.3322,Technology,IT Consulting & Software,"ANGELONE, CIGNITITEC, COFORGE, HCLTECH, INFY, LTIM, LTTS, MASTEK"
IND::IT Consulting & Software::B::B::A::A,IT Consulting & Software · Group 2,IT Consulting & Software,9,14,5,0.3311,0.3285,Technology,IT Consulting & Software,"BSOFT, CYIENT, CYIENTDLM, HCLTECH, INFY, KPITTECH, LTIM, LTTS"
IND::Other Apparels & Accessories,Other Apparels & Accessories,Other Apparels & Accessories,7,14,7,0.0931,0.1328,Consumer Cyclical,Other Apparels & Accessories,"ARVINDFASN, GOCOLORS, GREENLAM, ICIL, JUBLFOOD, KKCL, LGBBROSLTD, NITINSPIN"
IND::Other Financial Services,Other Financial Services,Other Financial Services,14,14,0,0.0789,0.0789,Financial Services,Other Financial Services,"360ONE, ANANDRATHI, BELRISE, CARERATING, CMSINFO, CRISIL, EDELWEISS, ICRA"
IND::Electric Utilities::A,Electric Utilities · Group 1,Electric Utilities,12,13,1,0.2644,0.274,Utilities,Electric Utilities,"ADANIENSOL, ADANIGREEN, ADANIPOWER, CESC, GAIL, JSWENERGY, NHPC, NLCINDIA"
IND::Heavy Electrical Equipment::B,Heavy Electrical Equipment · Group 2,Heavy Electrical Equipment,8,13,5,0.1405,0.1788,Industrials,Heavy Electrical Equipment,"AVALON, BANSALWIRE, BBL, GRAVITA, KEC, PITTIENG, PTCIL, SANSERA"
IND::Other Industrial Goods,Other Industrial Goods,Other Industrial Goods,9,13,4,0.11,0.1329,Industrials,Other Industrial Goods,"AIAENG, ESABINDIA, GRAPHITE, HEG, INOXINDIA, KPIL, RHIM, SBCL"
IND::Plastic Products,Plastic Products,Plastic Products,7,13,6,0.046,0.0981,Industrials,Plastic Products,"ASTRAL, FINPIPE, GRINDWELL, HGINFRA, HONAUT, IRB, NILKAMAL, PNCINFRA"
IND::Realty::B,Realty · Group 1,Realty,13,13,0,0.2753,0.2753,Real Estate,Realty,"ABREL, ANANTRAJ, BRIGADE, DLF, GODREJPROP, LODHA, MAXESTATES, OBEROIRLTY"
IND::Aluminium and Aluminium Products,Aluminium And Aluminium Products,Aluminium And Aluminium Products,5,12,7,0.4025,0.347,Basic Materials,Aluminium and Aluminium Products,"GRASIM, HINDALCO, HINDCOPPER, HINDZINC, JINDALSTEL, JSWSTEEL, NATIONALUM, NMDC"
IND::Auto Parts & Equipment::B::B::B,Auto Parts & Equipment · Group 3,Auto Parts & Equipment,9,12,3,0.2154,0.1755,Consumer Cyclical,Auto Parts & Equipment,"ARE&M, AUTOAXLES, CRAFTSMAN, DIVGIITTS, EXIDEIND, GABRIEL, JTEKTINDIA, MOTHERSON"
IND::Construction & Engineering,Construction & Engineering,Construction & Engineering,9,12,3,0.0795,0.0973,Industrials,Construction & Engineering,"AHLUCONT, FINPIPE, HGINFRA, KIRLOSENG, KNRCON, LT, NBCC, NCC"
UNCLASSIFIED::B::B::B::A,Cross-sector · Group 6,Cross-sector,9,12,3,0.2569,0.2276,,,"AJAXENGG, AKUMS, BBOX, BHARTIHEXA, COHANCE, EPACK, EUREKAFORB, HEXT"
IND::Healthcare Services,Healthcare Services,Healthcare Services,9,12,3,0.1765,0.1861,Healthcare,Healthcare Services,"AJANTPHARM, CIPLA, ETERNAL, KOVAI, KRSNAA, LALPATHLAB, MEDIASSIST, METROPOLIS"
IND::Pharmaceuticals::B::A::B::A,Pharmaceuticals · Group 3,Pharmaceuticals,10,12,2,0.1971,0.1912,Healthcare,Pharmaceuticals,"AARTIDRUGS, AARTIPHARM, BIOCON, BLUEJET, DIVISLAB, ERIS, FDC, HIKAL"
IND::Restaurants,Restaurants,Restaurants,5,12,7,0.3539,0.2504,Consumer Cyclical,Restaurants,"ASAHIINDIA, BALKRISIND, CAMPUS, DEVYANI, JUBLFOOD, METROBRAND, MHRIL, PAGEIND"
IND::Commercial Vehicles,Commercial Vehicles,Commercial Vehicles,5,11,6,0.1672,0.1775,Industrials,Commercial Vehicles,"ASHOKLEY, BEML, CGPOWER, ESCORTS, KEI, KSB, POLYCAB, TEGA"
IND::Commodity Chemicals,Commodity Chemicals,Commodity Chemicals,8,11,3,0.1481,0.1722,Basic Materials,Commodity Chemicals,"ACI, DEEPAKFERT, DEEPAKNTR, FINEORG, GHCL, INDIAGLYCO, NAVINFLUOR, SRF"
UNCLASSIFIED::A::B,Cross-sector · Group 4,Cross-sector,9,11,2,0.2701,0.1894,,,"AWL, BAJAJHFL, GMRAIRPORT, MUTHOOTMF, NORTHARC, PATELENG, PFOCUS, SHARDAMOTR"
UNCLASSIFIED::B::B::A::A::B,Cross-sector · Group 5,Cross-sector,9,11,2,0.1737,0.1452,,,"BHARTIHEXA, EPACK, FOSECOIND, GMRAIRPORT, IIFLCAPS, INTERARCH, ITCHOTELS, KRBL"
UNCLASSIFIED::B::B::B::B,Cross-sector · Group 7,Cross-sector,9,11,2,0.1701,0.1977,,,"ACMESOLAR, AJAXENGG, ALIVUS, CEIGALL, HEXT, JSWHL, NIVABUPA, SHARDAMOTR"
UNCLASSIFIED::B::B::A::A::A,Cross-sector · Group 8,Cross-sector,8,11,3,0.0619,0.0131,,,"AEGISVOPAK, ATHERENERG, BBOX, CEMPRO, IGIL, IKS, LAXMIDENTL, OSWALPUMPS"
IND::Industrial Machinery::A,Industrial Machinery · Group 1,Industrial Machinery,10,11,1,0.0752,0.1023,Industrials,Industrial Machinery,"3MINDIA, DOMS, FLAIR, GMMPFAUDLR, GODREJIND, ISGEC, KIRLOSBROS, SHRIPISTON"
IND::Mining,Mining,Mining,4,11,7,0.2854,0.3298,Basic Materials,Mining,"DHANUKA, HINDALCO, HINDCOPPER, JINDALSTEL, LINDEINDIA, MOIL, NMDC, SAIL"
IND::Specialty Retail,Specialty Retail,Specialty Retail,8,11,3,-0.0129,0.0547,Consumer Cyclical,Specialty Retail,"ARVINDFASN, AVL, BHARTIARTL, ETHOSLTD, KPRMILL, LANDMARK, MANYAVAR, MAYURUNIQ"
IND::Cigarettes-Tobacco Products,Cigarettes-tobacco Products,Cigarettes-tobacco Products,5,10,5,0.4722,0.3176,Consumer Defensive,Cigarettes-Tobacco Products,"DABUR, EMAMILTD, GODFRYPHLP, ITC, MARICO, ONESOURCE, TI, UBL"
IND::Forest Products,Forest Products,Forest Products,8,10,2,0.178,0.156,Basic Materials,Forest Products,"CENTURYPLY, DREDGECORP, GREENPANEL, GREENPLY, HINDZINC, IXIGO, KMEW, PARADEEP"
IND::Hotels,Hotels,Hotels,6,10,4,0.2898,0.2596,Consumer Cyclical,Hotels,"APOLLOTYRE, BORORENEW, CHALET, EIHOTEL, INDHOTEL, LEMONTREE, MHRIL, MRF"
IND::Iron & Steel Products,Iron & Steel Products,Iron & Steel Products,9,10,1,0.0461,0.0734,Basic Materials,Iron & Steel Products,"APLAPOLLO, HITECH, LINDEINDIA, MIDHANI, MOIL, SURYAROSNI, TIIL, USHAMART"
IND::Specialty Chemicals::B,Specialty Chemicals · Group 2,Specialty Chemicals,6,10,4,0.087,0.1366,Basic Materials,Specialty Chemicals,"BAYERCROP, CHEMPLASTS, DCMSHRIRAM, FINEORG, GALAXYSURF, NEOGEN, TATVA, TIRUMALCHM"
IND::Textiles,Textiles,Textiles,8,10,2,0.1488,0.1702,Consumer Cyclical,Textiles,"ARVIND, GARFIBRES, GOKEX, ICIL, INDHOTEL, KPRMILL, MAYURUNIQ, NITINSPIN"
IND::Cars & Utility Vehicles,Cars & Utility Vehicles,Cars & Utility Vehicles,3,9,6,0.3614,0.2863,Consumer Cyclical,Cars & Utility Vehicles,"EICHERMOT, FORCEMOT, LGBBROSLTD, LUMAXIND, M&M, MAHSCOOTER, MARUTI, NYKAA"
UNCLASSIFIED::B::A::A,Cross-sector · Group 10,Cross-sector,4,9,5,0.2975,0.1837,,,"AJAXENGG, HYUNDAI, ITCHOTELS, KRBL, MARATHON, SANATHAN, SANOFICONR, STLTECH"
UNCLASSIFIED::B::B::A::B::A,Cross-sector · Group 9,Cross-sector,6,9,3,0.3348,0.2448,,,"BLACKBUCK, DAMCAPITAL, EMCURE, FILATEX, NTPCGREEN, SAMBHV, SHARDAMOTR, SWANCORP"
IND::Department Stores,Department Stores,Department Stores,6,9,3,0.0846,0.0978,Consumer Cyclical,Department Stores,"ABFRL, DMART, FIEMIND, NITINSPIN, SHOPERSTOP, TRENT, V2RETAIL, VMART"
IND::Finance (including NBFCs)::A,Finance (including Nbfcs) · Group 3,Finance (including Nbfcs),6,9,3,0.1318,0.1454,Financial Services,Finance (including NBFCs),"ABSLAMC, CGCL, FEDFINA, IRFC, JIOFIN, JMFINANCIL, MASFIN, PFS"
IND::General Insurance,General Insurance,General Insurance,6,9,3,0.1022,0.1535,Financial Services,General Insurance,"AWFIS, ENTERO, GICRE, ICICIGI, PGIL, POLICYBZR, RELIGARE, SBILIFE"
IND::Refineries/Petro-Products,Refineries / Petro-products,Refineries / Petro-products,7,9,2,0.2299,0.3119,Energy,Refineries/Petro-Products,"BPCL, CHENNPETRO, COALINDIA, GMDCLTD, HINDPETRO, IOC, MRPL, ONGC"
IND::Asset Management Cos.,Asset Management Cos.,Asset Management Cos.,6,8,2,0.4033,0.3506,Financial Services,Asset Management Cos.,"ABSLAMC, CDSL, GVT&D, HDFCAMC, NAM-INDIA, PRUDENT, TARIL, UTIAMC"
IND::Fertilizers,Fertilizers,Fertilizers,3,8,5,0.0967,0.1995,Basic Materials,Fertilizers,"CHAMBLFERT, COROMANDEL, DEEPAKNTR, DHANUKA, JUBLINGREA, PARADEEP, SHYAMMETL, SUDARSCHEM"
IND::Household Appliances,Household Appliances,Household Appliances,6,8,2,-0.0166,0.0706,Consumer Cyclical,Household Appliances,"BAJAJELEC, CARTRADE, CARYSIL, CROMPTON, GREENLAM, IFBIND, NYKAA, RANEHOLDIN"
IND::Other Electrical Equipment/Products::A,Other Electrical Equipment / Products · Group 2,Other Electrical Equipment / Products,5,8,3,0.1824,0.247,Industrials,Other Electrical Equipment/Products,"APARINDS, INDIGO, KEI, KPIL, POLYCAB, RRKABEL, UNIVCABLES, WAAREEENER"
IND::Travel Support Services,Travel Support Services,Travel Support Services,3,8,5,0.0629,0.2585,Consumer Cyclical,Travel Support Services,"EIHOTEL, EXIDEIND, IRCTC, JAMNAAUTO, LANDMARK, MSUMI, THOMASCOOK, YATRA"
IND::Utilities:Non-Electrical,Utilities:non-electrical,Utilities:non-electrical,7,8,1,0.0668,0.0847,Utilities,Utilities:Non-Electrical,"GAIL, GSPL, GUJGASLTD, IGL, IONEXCHANG, MGL, POWERGRID, WABAG"
IND::Footwear,Footwear,Footwear,4,7,3,0.151,0.1975,Consumer Cyclical,Footwear,"BATAINDIA, CAMPUS, DEVYANI, JUBLFOOD, METROBRAND, REDTAPE, SAPPHIRE"
IND::Gems & Jewellery,Gems & Jewellery,Gems & Jewellery,4,7,3,0.1692,0.1935,Consumer Cyclical,Gems & Jewellery,"AMBER, BAJAJ-AUTO, KALYANKJIL, SENCO, THANGAMAYL, TITAN, UNOMINDA"
IND::Holding Companies,Holding Companies,Holding Companies,6,7,1,0.0311,0.0696,Financial Services,Holding Companies,"ABCAPITAL, BAJAJFINSV, BAJAJHLDNG, CHOLAHLDNG, ICICIBANK, JMFINANCIL, RANEHOLDIN"
IND::IT Software Products,IT Software Products,IT Software Products,7,7,0,0.0202,0.0202,Technology,IT Software Products,"CENTUM, CYIENTDLM, INTELLECT, OPTIEMUS, RATEGAIN, TATATECH, ZAGGLE"
IND::Life Insurance,Life Insurance,Life Insurance,5,7,2,0.3529,0.3351,Financial Services,Life Insurance,"BAJAJFINSV, HDFCLIFE, ICICIGI, ICICIPRULI, LICI, MFSL, SBILIFE"
IND::Oil Marketing & Distribution,Oil Marketing & Distribution,Oil Marketing & Distribution,7,7,0,0.2562,0.2562,Energy,Oil Marketing & Distribution,"AEGISLOG, CASTROLIND, GULFOILLUB, IOC, OIL, ONGC, PETRONET"
IND::Pharmaceuticals::A,Pharmaceuticals · Group 5,Pharmaceuticals,4,7,3,0.1367,0.1383,Healthcare,Pharmaceuticals,"AMRUTANJAN, BIOCON, JLHL, KOVAI, NEULANDLAB, PGHL, SUPRIYA"
IND::Roads & Highways,Roads & Highways,Roads & Highways,4,7,3,0.0955,0.1792,Industrials,Roads & Highways,"ASHOKA, GRINFRA, HAPPYFORGE, IRB, KNRCON, NCC, PNCINFRA"
IND::Transportation - Logistics,Transportation - Logistics,Transportation - Logistics,5,7,2,0.0761,0.1775,Industrials,Transportation - Logistics,"BLUEDART, DELHIVERY, GATEWAY, MAHLOG, MMFL, RRKABEL, VRLLOG"
IND::Auto Tyres & Rubber Products,Auto Tyres & Rubber Products,Auto Tyres & Rubber Products,5,6,1,0.1866,0.1666,Consumer Cyclical,Auto Tyres & Rubber Products,"APOLLOTYRE, AVL, BALKRISIND, CEATLTD, JKTYRE, MRF"
IND::Houseware,Houseware,Houseware,5,6,1,0.1755,0.118,Consumer Cyclical,Houseware,"BORORENEW, CAMPUS, LAOPALA, PNGJL, STOVEKRAFT, TTKPRESTIG"
IND::Pharmaceuticals::B::A::A,Pharmaceuticals · Group 4,Pharmaceuticals,6,6,0,0.2007,0.2007,Healthcare,Pharmaceuticals,"APLLTD, CAPLIPOINT, CIPLA, NATCOPHARM, SPARC, WINDLAS"
IND::Electric Utilities::B,Electric Utilities · Group 2,Electric Utilities,4,5,1,0.1557,0.1552,Industrials,Electric Utilities,"AHLUCONT, INOXGREEN, INOXWIND, KPIL, TECHNOE"
IND::Other Food Products,Other Food Products,Other Food Products,3,5,2,-0.0106,0.1759,Consumer Defensive,Other Food Products,"AVANTIFEED, EIDPARRY, GODFRYPHLP, MANORAMA, MARICO"
IND::Paper & Paper Products,Paper & Paper Products,Paper & Paper Products,3,5,2,0.0871,0.21,Basic Materials,Paper & Paper Products,"FINEORG, JKPAPER, SURYAROSNI, TCPLPACK, WSTCSTPAPR"
IND::Biotechnology,Biotechnology,Biotechnology,3,4,1,0.033,0.1337,Healthcare,Biotechnology,"ADVENZYMES, AMRUTANJAN, BIOCON, CONCORDBIO"
THEME::Cdmo,CDMO,CDMO,4,4,0,0.4521,0.4521,,,"ACUTAAS, GODIGIT, SAILIFE, SENORES"
IND::Containers & Packaging,Containers & Packaging,Containers & Packaging,3,4,1,-0.0185,0.1099,Consumer Cyclical,Containers & Packaging,"EPL, GRWRHITECH, MAYURUNIQ, MOLDTKPAC"
IND::Exchange,Exchange,Exchange,3,4,1,0.0996,0.1436,Financial Services,Exchange,"BSE, CDSL, IEX, MCX"
IND::IT Consulting & Software::B::B::B,IT Consulting & Software · Group 3,IT Consulting & Software,4,4,0,0.1996,0.1996,Technology,IT Consulting & Software,"ECLERX, NETWEB, NEWGEN, OFSS"
IND::IT Consulting & Software::A,IT Consulting & Software · Group 4,IT Consulting & Software,3,4,1,0.3025,0.3359,Technology,Capital Markets,"CAMS, FSL, KFINTECH, RAMCOSYS"
IND::Marine Port & Services,Marine Port & Services,Marine Port & Services,3,4,1,0.2623,0.296,Industrials,Marine Port & Services,"ADANIPORTS, GPPL, JSWINFRA, TEXRAIL"
IND::Auto Parts & Equipment::A,Auto Parts & Equipment · Group 4,Auto Parts & Equipment,3,3,0,0.1523,0.1523,Industrials,Auto Parts & Equipment,"GREAVESCOT, SANDHAR, SUNCLAY"
UNCLASSIFIED::NoRank,Cross-sector (no Rank) · Group 4,Cross-sector (no Rank),3,3,0,,,,,"BLUESTONE, PIRAMALFIN, VIKRAMSOLR"
IND::IT Consulting & Software::B::A,IT Consulting & Software · Group 5,IT Consulting & Software,3,3,0,0.2846,0.2846,Technology,Commodity Trading & Distribution,"ADANIENT, HAPPSTMNDS, REDINGTON"
IND::Realty::A,Realty · Group 2,Realty,3,3,0,0.0699,0.0699,Real Estate,Realty,"ARVSMART, MAHLIFE, NESCO"
